url,articleTitle,commentCount
https://www.foxnews.com/politics/huawei-executive-arrest-will-not-hinder-trade-talks-with-china-kudlow-says,"Huawei executive's arrest will not hinder trade talks with China, Kudlow says",31
https://www.foxnews.com/politics/george-h-w-bush-mourners-pay-tribute-to-the-late-president-with-colorful-socks,George H.W. Bush mourners pay tribute to the late president with colorful socks,30
https://www.foxnews.com/politics/who-is-gen-mark-milley-trumps-pick-for-joint-chiefs-chairman,"Who is Gen. Mark Milley, Trump's pick for Joint Chiefs Chairman?",25
https://www.foxnews.com/politics/lawmakers-re-elect-guardian-of-new-hampshire-primary-despite-work-on-trump-election-commission,"Lawmakers re-elect guardian of New Hampshire primary, despite work on Trump election commission",24
https://www.foxnews.com/politics/george-h-w-bush-remembered-as-someone-you-wouldve-wanted-on-your-side-former-senator-eulogizes,"George H.W. Bush remembered as someone ‘you would’ve wanted on your side,’ Sen. Alan Simpson eulogizes",23
https://www.foxnews.com/politics/top-fbi-official-bill-priestap-to-leave-government,Top FBI official Bill Priestap to leave government,19
https://www.foxnews.com/politics/george-h-w-bush-to-be-honored-with-missing-man-flyover-at-funeral,George H.W. Bush to be honored with missing man flyover at funeral,18
https://www.foxnews.com/politics/flight-status-c-a-v-u,Flight Status: C-A-V-U,16
https://www.foxnews.com/politics/lame-duck-indeed,"Lame duck, indeed",15
https://www.foxnews.com/politics/george-h-w-bushs-funeral-program-for-texas-services-thursday,George H.W. Bush's funeral program for Texas services Thursday,8
https://www.foxnews.com/politics/george-papadopoulos-ex-trump-aide-implicated-in-russia-probe-who-is-he,"George Papadopoulos, ex-Trump aide, implicated in Russia probe: Who is he?",6
https://www.foxnews.com/politics/bob-bergland-former-agriculture-secretary-dies-at-90,"Bob Bergland, former agriculture secretary, dies at 90",5
